{
    "$schema": "https://json-schema.org/draft/2020-12/schema",
    "$id": "/schemas/data/services.schema.json",
    "title": "Services Schema",
    "description": "Schema for validating service objects used in the data.scilifelab.se",
    "type": "array",
    "items": {
      "type": "object",
      "required": [
        "owner",
        "type",
        "search_tags",
        "name",
        "description",
        "url",
        "maintained_by"
      ],
      "properties": {
        "owner": {
          "type": "array",
          "items": {
            "type": "string",
            "enum": [
              "SciLifeLab Data Centre",
              "NBIS",
              "SciLifeLab Affiliated",
              "SciLifeLab Infrastructure"
            ]
          },
          "minItems": 1,
          "uniqueItems": true,
          "description": "responsible for the service."
        },
        "type": {
          "type": "array",
          "items": {
            "type": "string",
            "minLength": 1
          },
          "minItems": 1,
          "uniqueItems": true,
          "description": "One or more categories describing the type of service."
        },
        "search_tags": {
          "type": "array",
          "items": {
            "type": "string",
            "minLength": 1
          },
          "minItems": 1,
          "uniqueItems": true,
          "description": "Search keywords associated with the service."
        },
        "weight": {
           "type": "integer",
            "minimum": 0,
            "description": "OPTIONAL: Position on the services page. Lower numbers are shown first; services without a weight are listed alphabetically after weighted ones."
        },
        "name": {
          "type": "string",
          "minLength": 1,
          "description": "Title or name of the service."
        },
        "description": {
          "type": "string",
          "minLength": 1,
          "description": "Short description about the service."
        },
        "thumbnail": {
          "type": "string",
          "description": "OPTIONAL: Path to a thumbnail image for the service.",
          "pattern": "^\\/img\\/service_thumbnails\\/[^\\s]+\\.(jpg|jpeg|png|svg)$"
        },
        "thumbnail_border": {
          "type": "boolean",
          "description": "OPTIONAL: Whether to display a border around the thumbnail image.",
          "default": false
        },
        "url": {
          "type": "string",
          "description": "URL linking to the service.",
          "pattern": "^(https?:\\/\\/|\\/|mailto:).+"
        },
        "maintained_by": {
          "type": "string",
          "minLength": 1,
          "description": "Name of the individual or organization that maintains the service."
        },
        "maintained_by_url": {
          "type": "string",
          "format": "uri",
          "description": "OPTIONAL: Web address of the maintaining organization or individual."
        },
        "support_email": {
          "type": "string",
          "format": "email",
          "description": "OPTIONAL: Email address to contact for support regarding the service."
        },
        "support_website": {
          "type": "string",
          "format": "uri",
          "description": "OPTIONAL: Website URL for service support or documentation."
        },
        "support_github": {
          "type": "string",
          "format": "uri",
          "description": "OPTIONAL: GitHub repository URL for the service."
        },
        "support_status": {
          "type": "string",
          "format": "uri",
          "description": "OPTIONAL: Status page URL for the service."
        },
        "support_slack": {
          "type": "string",
          "format": "uri",
          "description": "OPTIONAL: Slack channel or workspace URL for service support."
        },
        "support_impact": {
          "type": "string",
          "format": "uri",
          "description": "OPTIONAL: Link to dashboard showing impact of the service."
        },
        "data_source_type": {
          "type": "array",
          "items": {
            "type": "string",
            "minLength": 1
          },
          "uniqueItems": true,
          "description": "OPTIONAL: Type of data source associated with the service."
        },
        "ddls": {
          "type": "array",
          "items": {
            "type": "string",
            "minLength": 1
          },
          "uniqueItems": true,
          "description": "OPTIONAL: Scientific area of the services that are also data sources."
        },
        "disease_type": {
          "type": "array",
          "items": {
            "type": "string",
            "minLength": 1
          },
          "uniqueItems": true,
          "description": "OPTIONAL: Disease types associated with the services that are also data sources."
        }
      },
      "additionalProperties": false
    }
}
